{
  "characterId": "char_001",
  "name": {
    "full": "Ari Solen",
    "nickname": "Ari",
    "title": "Skybound Courier"
  },

  "identity": {
    "age": 24,
    "genderExpression": "androgynous",
    "pronouns": ["they", "them"],
    "species": "human",
    "ethnicity": "mixed",
    "cultureInfluence": ["Nordic", "Futuristic Urban"]
  },

  "body": {
    "height": {
      "value": 172,
      "unit": "cm",
      "relative": "slightly below average"
    },
    "build": {
      "overall": "lean athletic",
      "details": ["toned arms", "runner’s legs", "narrow waist"]
    },
    "posture": {
      "default": "relaxed but alert",
      "walkStyle": "light-footed, quick, purposeful"
    },
    "skin": {
      "tone": "light olive",
      "undertone": "warm",
      "texture": ["smooth", "subtle freckles across nose and cheeks"],
      "marks": [
        {
          "type": "scar",
          "location": "left eyebrow",
          "description": "thin diagonal line, barely breaking the brow"
        },
        {
          "type": "tattoo",
          "location": "right forearm",
          "description": "minimalist constellation pattern in fine white ink"
        }
      ]
    }
  },

  "face": {
    "shape": "oval with slightly sharp jawline",
    "features": {
      "eyes": {
        "shape": "almond",
        "size": "medium",
        "color": {
          "base": "steel blue",
          "details": "silver flecks near pupil"
        },
        "brows": {
          "shape": "softly arched",
          "thickness": "medium",
          "notes": "left brow interrupted by small scar"
        },
        "expressionDefault": "curious, observant",
        "expressionRange": ["playful", "focused", "softly distant"]
      },
      "nose": {
        "shape": "straight",
        "size": "proportional",
        "tip": "slightly rounded"
      },
      "mouth": {
        "lipShape": "full lower lip, defined cupid’s bow",
        "lipSize": "medium",
        "defaultExpression": "half-smile, corners slightly lifted",
        "teeth": "even, slightly imperfect canine on right"
      },
      "cheeks": {
        "definition": "subtle",
        "notes": "freckles more visible in bright light"
      },
      "chin": {
        "shape": "softly pointed",
        "definition": "moderate"
      }
    }
  },

  "hair": {
    "length": "medium",
    "overallStyle": "undercut with tousled top",
    "color": {
      "base": "dark brown",
      "highlights": "muted copper streaks near front",
      "roots": "natural",
      "tips": "slightly lighter from sun exposure"
    },
    "texture": "slightly wavy",
    "parting": "messy, usually pushed to the right",
    "movement": "falls into eyes when they lean forward",
    "facialHair": {
      "hasFacialHair": false,
      "description": null
    }
  },

  "eyesDetail": {
    "glasses": {
      "wearsGlasses": true,
      "type": "round, thin metal frame",
      "color": "matte gunmetal",
      "notes": "often pushed up onto head when concentrating"
    },
    "other": {
      "makeup": {
        "style": "minimal",
        "details": "thin line of dark liner, subtle"
      }
    }
  },

  "clothing": {
    "overallStyle": "functional streetwear with light sci-fi elements",
    "primaryOutfit": {
      "top": {
        "type": "fitted utility jacket",
        "color": "charcoal grey",
        "material": "weather-resistant fabric",
        "details": [
          "asymmetric zipper",
          "small reflective strips on shoulders",
          "hidden inner pockets"
        ]
      },
      "innerLayer": {
        "type": "simple long-sleeve shirt",
        "color": "muted teal",
        "material": "soft cotton blend"
      },
      "bottom": {
        "type": "tapered cargo pants",
        "color": "dark navy",
        "material": "durable, slightly stretchy",
        "details": [
          "low-profile pockets",
          "reinforced knees",
          "subtle stitched pattern along sides"
        ]
      },
      "footwear": {
        "type": "lightweight boots",
        "color": "black with teal accents",
        "material": "synthetic leather and mesh",
        "details": [
          "magnetic clasp instead of laces",
          "slightly worn soles",
          "scuff marks on outer edges"
        ]
      },
      "outerwearOptional": {
        "type": "hooded cloak",
        "color": "deep slate",
        "material": "thin, flowing, water-resistant",
        "usage": "worn in bad weather or covert runs"
      }
    }
  },

  "accessories": {
    "jewelry": [
      {
        "type": "earring",
        "location": "left ear helix",
        "description": "small silver ring",
        "symbolism": "gift from an old friend"
      },
      {
        "type": "ring",
        "location": "right index finger",
        "description": "simple black band",
        "symbolism": "personal reminder, no visible engraving"
      }
    ],
    "gear": [
      {
        "type": "satchel",
        "position": "crossbody",
        "color": "dark grey",
        "details": "compact, reinforced corners, multiple compartments"
      },
      {
        "type": "wrist device",
        "position": "left wrist",
        "description": "sleek band with faint glowing interface",
        "color": "black with cyan glow",
        "functionHint": "navigation and communication"
      }
    ],
    "other": [
      {
        "type": "patch",
        "location": "right shoulder of jacket",
        "description": "stylized wing emblem",
        "color": "white on teal",
        "symbolism": "courier guild insignia"
      }
    ]
  },

  "colorPalette": {
    "dominant": ["charcoal grey", "dark navy", "muted teal"],
    "accents": ["copper", "cyan glow", "silver"],
    "mood": "cool, grounded, slightly futuristic"
  },

  "styleAndVibe": {
    "visualKeywords": [
      "urban explorer",
      "subtle sci-fi",
      "practical elegance",
      "quiet confidence"
    ],
    "firstImpression": "calm, capable, observant; looks like they know the city’s hidden routes",
    "silhouette": "slim, layered, slightly asymmetrical with cloak adding flow when worn",
    "motionFeel": "quick, precise movements; rarely wasted gestures"
  },

  "environmentContext": {
    "typicalSetting": "dense vertical city with skybridges and rooftop routes",
    "lighting": [
      "cool neon reflections at night",
      "soft overcast daylight",
      "warm interior café lighting"
    ],
    "weatherInteraction": [
      "jacket collar raised in wind",
      "cloak billowing slightly in rain",
      "hair catching stray beams of sunset light"
    ]
  },

  "expressionVariants": [
    {
      "name": "Focused Run",
      "eyes": "narrowed, tracking distant point",
      "mouth": "neutral, slightly pressed",
      "body": "leaning forward, shoulders engaged",
      "notes": "glasses pushed up, cloak trailing behind"
    },
    {
      "name": "Soft Smile",
      "eyes": "relaxed, faint crinkle at corners",
      "mouth": "gentle smile, more on one side",
      "body": "weight shifted to one leg, hands in pockets",
      "notes": "freckles more noticeable, vibe approachable"
    },
    {
      "name": "Quiet Planning",
      "eyes": "distant, unfocused on immediate surroundings",
      "mouth": "neutral, lips slightly parted",
      "body": "one hand on wrist device, other resting on satchel strap",
      "notes": "feels like they’re mapping routes in their head"
    }
  ],

  "meta": {
    "intendedMediums": [
      "concept art",
      "3D character model",
      "visual novel portrait"
    ],
    "detailLevel": "high",
    "referenceNotes": [
      "Keep silhouette readable even in low light.",
      "Highlight subtle tech elements without making them dominant.",
      "Freckles and scar are key identity markers—do not omit."
    ]
  }
}
